Название,Цена
Молоко Му-у ультрапастеризованное 3.2% БЗМЖ 925мл,109.99
Молоко Му-у ультрапастеризованное 2.5% БЗМЖ 925мл,114.99
Молоко Простоквашино безлактозное ультрапастеризованное 1.5% БЗМЖ 0.97л,133.99
Молоко С Нашей Фермы ультрапастеризованное 3.2% БЗМЖ 925мл,99.99
Молоко Домик в деревне ультрапастеризованное 2.5% БЗМЖ 950г,113.99
Молоко Сарафаново безлактозное ультрапастеризованное 1.5% БЗМЖ 970мл,129.99
Молоко М ультрапастеризованное 3.2% БЗМЖ 950г,114.99
Молоко Сарафаново детское ультрапастеризованное 2.5% БЗМЖ 970мл,124.99
Молоко Parmalat Natura Premium питьевое ультрапастеризованное 3.5% БЗМЖ 1л,139.99
Молоко ЭкоНива ультрапастеризованное 3.2% БЗМЖ 1л,104.99
