Название,Цена
Молоко ТД Сметанин ультрапастеризованное 2.5% 900г,69.99
Молоко Вкуснотеево ультрапастеризованное 2.5% 900г,116.99
Молоко Кубанская Буренка ультрапастеризованное 3.5% 950г,119.99
Молоко Домик в деревне ультрапастеризованное 3.5% 950г,135.99
Молоко Калория питьевое ультрапастеризованное 2.5% 1л,99.99
Молоко Село Зеленое ультрапастеризованное 2.5% 950мл,99.99
Молоко Кубанская Буренка ультрапастеризованное 6% 950г,186.99
Молоко Домик в деревне Безлактозное ультрапастеризованное 1.8% 950г,129.99
Молоко Вкуснотеево Barista ультрапастеризованное 3.5% 950г,129.99
Молоко Вкуснотеево ультрапастеризованное 2.5% 950мл,132.99
Молоко Козочка с облачка козье ультрапастеризованное 5.6% 200мл,63.99
Молоко Parmalat безлактозное ультрапастеризованное 3.5% 1л,197.99
Молоко Простоквашино безлактозное ультрапастеризованное 1.5% 970мл,123.99
Молоко Домик в деревне ультрапастеризованное 1.5% 950г,124.99
Молоко Parmalat Natura Premium Comfort безлактозное ультрапастеризованное 1.8% 1л,169.99
Молоко Домик в деревне ультрапастеризованное 6% 950г,189.99
Молоко Простоквашино ультрапастеризованное 2.5% 950мл,143.99
