Название,Цена
"Колбаса вареная РУБЛЁВСКИЙ Докторская, 400г",289.99
"Колбаса вареная ВЯЗАНКА Молокуша, 400г",159.99
"Колбаса вареная СТАРОДВОРЬЕ Стародворская Традиционная, 400г",164.99
"Колбаса вареная БЛИЖНИЕ ГОРКИ Домашняя, 400г",189.99
"Колбаса вареная СТАРОДВОРЬЕ Филедворская по-стародворски, 400г",164.99
"Колбаса вареная ВЯЗАНКА Филейская Вязанка, 400г",269.99
"Колбаса вареная СТАРОДВОРЬЕ Молочная Традиционная, 400г",164.99
"Колбаса вареная РУБЛЕВСКИЕ КОЛБАСЫ Русская, 400г",309.99
"Колбаса вареная PREMIUM CLUB Ветчинная из индейки, 400г",239.99
"Колбаса вареная МК ВЕЛИКОЛУКСКИЙ Докторская ГОСТ, 400г",149.99
"Колбаса вареная РУБЛЕВСКИЕ КОЛБАСЫ Докторская, категория А, 400г",252.49
"Колбаса вареная РУБЛЁВСКИЙ Молочная, 400г",279.99
"Колбаса вареная ВЕЛКОМ Телячья, 400г",214.99
"Колбаса вареная ВЕЛКОМ Языковая, 400г",249.99
"Колбаса вареная ВЕЛКОМ Докторская, 400г",229.99
"Колбаса вареная КОРОВИНО Молочная, 400г",219.99
